{
  "contract_version": "ai_evaluation_case_v1",
  "evaluation_set_id": "ai-p2-evaluation-set-v1",
  "evaluation_set_version": 1,
  "evaluation_set_hash": "25a7c2e01806205b1dc30b7d6f9f2580d897685ea5a89df52b5c9bfee7796c18",
  "canonicalization_rule_id": "ai-evaluation-set-canonical-json-v1",
  "created_at": "2026-09-05T21:15:51Z",
  "manifest_reference": {
    "manifest_id": "ai-p2-corpus-manifest-v1",
    "manifest_version": 1,
    "manifest_hash": "c2053a7e2847b10c509de54468743615d2f38bb2d21bc4118da51be8a1a70338",
    "record_locator": "evaluation/ai-orchestration/p2/corpus-manifest-v1.json"
  },
  "policy_versions": {
    "access_policy_id": "ai-evidence-access-policy-v1",
    "freshness_conflict_policy_id": "ai-evidence-freshness-conflict-policy-v1",
    "scoring_rule_version": "p1-deterministic-task-success-v1"
  },
  "split_policy": {
    "total_cases": 28,
    "family_count": 7,
    "cases_per_family": 4,
    "calibration_count": 7,
    "development_count": 7,
    "holdout_count": 14,
    "assignment_rule": "01_calibration_02_development_03_and_04_holdout_per_family"
  },
  "policy_fixture_register": {
    "fixture_set_id": "ai-p2-policy-fixtures-v1",
    "fixture_set_version": 1,
    "fixture_set_hash": "9a106587ebca205db5a54c2c3556bf61765d8e226254725899d58789d7cc52c6",
    "record_locator": "evaluation/ai-orchestration/p2/policy-fixtures-v1.json"
  },
  "holdout_gold_boundary": {
    "gold_set_id": "ai-p2-holdout-gold-v1",
    "gold_set_version": 1,
    "gold_set_hash": "c70cc969a32ea5989e8cf78c8c5ef3420f789998d1a986467d9d7850b49e2ebf",
    "record_locator": "evaluation/ai-orchestration/p2/holdout/holdout-gold-v1.json",
    "candidate_access": false,
    "prompt_input_eligible": false,
    "retrieval_input_eligible": false,
    "tuning_input_eligible": false,
    "release_condition": "candidate_configuration_frozen_for_holdout_run"
  },
  "cases": [
    {
      "case_id": "ST-01",
      "family": "structured",
      "split": "calibration",
      "case_shape": "exact_value",
      "prompt": "What was the GB daily average net imbalance volume on 2026-02-25? Give the value, unit, date and evidence reference.",
      "as_of": "2026-09-05T07:00:00Z",
      "request_mode": "exact_historical",
      "candidate_visible": true,
      "evidence_resolution_status": "contract_blocked",
      "candidate_input_scope": {"manifest_id": "ai-p2-corpus-manifest-v1", "manifest_version": 1, "manifest_hash": "c2053a7e2847b10c509de54468743615d2f38bb2d21bc4118da51be8a1a70338", "approved_evidence_ids": [], "blocked_reference_ids": ["SF-05"], "policy_fixture_ids": []},
      "gold": {
        "gold_id": "IG-ST-01",
        "case_id": "ST-01",
        "scoring_rule_version": "p1-deterministic-task-success-v1",
        "expected_route": "structured",
        "allowed_outcome_codes": ["insufficient_evidence"],
        "primary_outcome_code": "insufficient_evidence",
        "required_available_evidence_ids": [],
        "required_unavailable_evidence_ids": ["SF-05"],
        "required_fixture_ids": [],
        "forbidden_evidence_ids": ["raw-or-failed-data", "local-structured-sample"],
        "mandatory_facts": [],
        "mandatory_qualifications": ["SF-05 is contract-blocked because its 48 scalar operands were not retained."],
        "prohibited_claims": ["Do not state the selected aggregate value as supported."],
        "assertions": {"freshness": "valid_for_requested_window", "conflict": "no_material_conflict", "safety": "permitted", "citation_mode": "none_allowed", "grounding_no_unsupported_claims": true, "trace_requires_versions": true, "trace_requires_cost": true}
      }
    },
    {
      "case_id": "ST-02",
      "family": "structured",
      "split": "development",
      "case_shape": "derived_comparison",
      "prompt": "Compare the GB daily average net imbalance volume on 2026-02-25 with 2026-05-28 and calculate the signed difference in MWh.",
      "as_of": "2026-09-05T07:00:00Z",
      "request_mode": "exact_historical",
      "candidate_visible": true,
      "evidence_resolution_status": "contract_blocked",
      "candidate_input_scope": {"manifest_id": "ai-p2-corpus-manifest-v1", "manifest_version": 1, "manifest_hash": "c2053a7e2847b10c509de54468743615d2f38bb2d21bc4118da51be8a1a70338", "approved_evidence_ids": [], "blocked_reference_ids": ["SF-05", "SF-06"], "policy_fixture_ids": []},
      "gold": {
        "gold_id": "IG-ST-02",
        "case_id": "ST-02",
        "scoring_rule_version": "p1-deterministic-task-success-v1",
        "expected_route": "structured",
        "allowed_outcome_codes": ["insufficient_evidence"],
        "primary_outcome_code": "insufficient_evidence",
        "required_available_evidence_ids": [],
        "required_unavailable_evidence_ids": ["SF-05", "SF-06"],
        "required_fixture_ids": [],
        "forbidden_evidence_ids": ["raw-or-failed-data", "local-structured-sample"],
        "mandatory_facts": [],
        "mandatory_qualifications": ["Both operands are contract-blocked, so no supported comparison or signed difference can be calculated."],
        "prohibited_claims": ["Do not calculate from blocked aggregate values.", "Do not provide a partial numeric result."],
        "assertions": {"freshness": "valid_for_requested_window", "conflict": "no_material_conflict", "safety": "permitted", "citation_mode": "none_allowed", "grounding_no_unsupported_claims": true, "trace_requires_versions": true, "trace_requires_cost": true}
      }
    },
    {
      "case_id": "ST-03",
      "family": "structured",
      "split": "holdout",
      "case_shape": "time_unit_discrimination",
      "prompt": "For GB on 2026-08-21, report the selected daily average net imbalance volume in GBP/MWh and cite the supporting structured evidence.",
      "as_of": "2026-09-05T07:00:00Z",
      "request_mode": "exact_historical",
      "candidate_visible": true,
      "evidence_resolution_status": "contract_blocked",
      "candidate_input_scope": {"manifest_id": "ai-p2-corpus-manifest-v1", "manifest_version": 1, "manifest_hash": "c2053a7e2847b10c509de54468743615d2f38bb2d21bc4118da51be8a1a70338", "approved_evidence_ids": [], "blocked_reference_ids": ["SF-07"], "policy_fixture_ids": []},
      "gold_boundary": {"gold_id": "HG-ST-03", "gold_set_id": "ai-p2-holdout-gold-v1", "gold_set_version": 1, "candidate_visible": false}
    },
    {
      "case_id": "ST-04",
      "family": "structured",
      "split": "holdout",
      "case_shape": "present_record_missing_metric",
      "prompt": "Using the selected INDO dataset metadata record as observed on 2026-09-05, what was GB electricity demand in MW? Cite the record.",
      "as_of": "2026-09-05T08:13:20Z",
      "request_mode": "exact_historical",
      "candidate_visible": true,
      "evidence_resolution_status": "ready",
      "candidate_input_scope": {"manifest_id": "ai-p2-corpus-manifest-v1", "manifest_version": 1, "manifest_hash": "c2053a7e2847b10c509de54468743615d2f38bb2d21bc4118da51be8a1a70338", "approved_evidence_ids": ["SF-08"], "blocked_reference_ids": [], "policy_fixture_ids": []},
      "gold_boundary": {"gold_id": "HG-ST-04", "gold_set_id": "ai-p2-holdout-gold-v1", "gold_set_version": 1, "candidate_visible": false}
    },
    {
      "case_id": "DO-01",
      "family": "document",
      "split": "calibration",
      "case_shape": "known_passage",
      "prompt": "According to the selected DESNZ passage published on 2026-04-21, approximately how often did gas set Britain's electricity price in the early 2020s and at publication time?",
      "as_of": "2026-09-05T07:00:00Z",
      "request_mode": "exact_historical",
      "candidate_visible": true,
      "evidence_resolution_status": "ready",
      "candidate_input_scope": {"manifest_id": "ai-p2-corpus-manifest-v1", "manifest_version": 1, "manifest_hash": "c2053a7e2847b10c509de54468743615d2f38bb2d21bc4118da51be8a1a70338", "approved_evidence_ids": ["DOC-05", "DP-05"], "blocked_reference_ids": [], "policy_fixture_ids": []},
      "gold": {
        "gold_id": "IG-DO-01",
        "case_id": "DO-01",
        "scoring_rule_version": "p1-deterministic-task-success-v1",
        "expected_route": "document",
        "allowed_outcome_codes": ["answered"],
        "primary_outcome_code": "answered",
        "required_available_evidence_ids": ["DOC-05", "DP-05"],
        "required_unavailable_evidence_ids": [],
        "required_fixture_ids": [],
        "forbidden_evidence_ids": ["full-external-articles", "local-rss-descriptions"],
        "mandatory_facts": ["Gas set Britain's electricity price around 90% of the time in the early 2020s and around 60% at publication time."],
        "mandatory_qualifications": ["Attribute both approximate percentages to the selected DESNZ passage."],
        "prohibited_claims": ["Do not present either approximate percentage as an independently measured structured fact."],
        "assertions": {"freshness": "valid_for_requested_window", "conflict": "no_material_conflict", "safety": "permitted", "citation_mode": "exact_required", "grounding_no_unsupported_claims": true, "trace_requires_versions": true, "trace_requires_cost": true}
      }
    },
    {
      "case_id": "DO-02",
      "family": "document",
      "split": "development",
      "case_shape": "metadata_provenance",
      "prompt": "Which selected publisher and dated document defines tracker tariffs as having gas and electricity unit costs that fluctuate daily with live wholesale prices? Provide the public citation.",
      "as_of": "2026-09-05T07:00:00Z",
      "request_mode": "exact_historical",
      "candidate_visible": true,
      "evidence_resolution_status": "ready",
      "candidate_input_scope": {"manifest_id": "ai-p2-corpus-manifest-v1", "manifest_version": 1, "manifest_hash": "c2053a7e2847b10c509de54468743615d2f38bb2d21bc4118da51be8a1a70338", "approved_evidence_ids": ["DOC-06", "DP-06"], "blocked_reference_ids": [], "policy_fixture_ids": []},
      "gold": {
        "gold_id": "IG-DO-02",